opinion_id,author,recommendation,score,content,pros,cons,helpful,unhelpful,publish_date,purchase_date
20379724,k...5,Polecam,5/5,"Zero zdziwienia że jest to najlepiej sprzedający się Resident w historii marki. Klimat, niepokój, historia, grafika, wszystko na najwyższym poziomie. A do tego łączy w sobie elementy które pokochali zarówno fani odsłon nastawionych na survival jak i fani odsłon nastawionych na akcje.",,,0,0,2026-03-13 10:47:47,2026-03-06 19:48:12
20310273,Elżbieta,Polecam,5/5,"Póki co czekam na dzień premiery, ale gameplay mówi wszystko. Ewentualna edycja opinii będzie po otrzymaniu zamówienia.",,,0,0,2026-02-19 07:06:07,2026-02-18 09:25:38
20364235,m...a,Polecam,5/5,Coś przepięknego. Wspaniała gra z nietuzinkowym klimatem - dla fanów serii i nie tylko - pozycja obowiązkowa!,,,0,0,2026-03-07 11:15:45,2026-02-27 20:42:07
20320231,Karriixz,Polecam,5/5,"Powrót Leona, powrót akcji. Resident wraca i znów wspaniały.",,,0,0,2026-02-21 15:13:54,2026-02-20 22:30:34
20349119,m...k,Polecam,5/5,Szybko wszytko nadane zrealizowane na czas polecam sklep..,,,0,0,2026-03-02 11:08:07,2026-02-25 08:50:26
20387935,l...1,Polecam,5/5,Rewelacyjnie się bawiłem przy tym tytule. Polecam zagrać.,,,0,0,2026-03-17 14:39:59,2026-02-24 15:21:13
20349393,c...9,Polecam,5/5,"Dla mnie najlepsza część, polecam",,,0,0,2026-03-02 13:10:59,2026-02-25 09:20:23
20357538,e...r,Polecam,5/5,Wszystko w porządku,,,0,0,2026-03-05 07:58:52,2026-02-24 18:20:26
20394775,m...4,Polecam,5/5,Jest dobrze .,,,0,0,2026-03-19 16:04:15,2026-02-26 05:15:25
20345911,p bialczak,,3/5,"Resident Evil Requiem zamówiony miesiąc przed premierą, nie dotarł do dzisiejszego dnia. Jak dotrze to zaktualizuje ocenę.",,,0,1,2026-02-28 18:59:10,2026-01-30 20:10:29
